Address;Title;Description;Rooms;Living Space (sqm);Price
5015 Erlinsbach;Wohnhaus mit Einliegerwohnung und herrlichem Garten;Dieses Immobilienangebot wird Ihnen im Auftrag der Eigentümerschaft durch Raiffeisen Immomakler präsentiert. Entsprechend werden Ihre Daten aus diesem Kontaktformular direkt an die Eigentümerschaft übermittelt.Das beeindruckende 9-Zimmer-Einfamilienhaus präsentiert sich auf einem enormen Grundstück (1412 m2) mit wunderbarem Baumbestand und viel Platz zum Spielen, Grillieren und um Partys zu feiern. Die Bushaltestelle befindet sich praktisch vor der Haustüre und die Ortsmitte sowie die Einkaufsmöglichkeiten sind problemlos zu Fuss erreichbar.Die gepflegte Liegenschaft begeistert mit dem umfangreichen Raumangebot und dem durchdachten Grundriss, der eine optimale Privatsphäre für alle Familienmitglieder ermöglicht. Die moderne Gasheizung wurde 2020 installiert. Das Wohnhaus besteht aus einer 5.5-Zimmerwohnung und einer separat zugänglichen grosszügigen 3.5-Zimmerwohnung im Obergeschoss, welche über einen sonnigen Südbalkon verfügt. Die 5.5-Zimmer-Familienwohnung empfängt Sie im Erdgeschoss mit dem einladenden Entrée mit praktischer Garderobe und dem angrenzenden Badezimmer mit Dusche. Der Korridor führt einerseits zum Schlafbereich mit zwei Zimmern und einem Bad mit Badewanne. Andererseits gelangen Sie vom Eingangsbereich in die helle Küche und zum Wohn- Esszimmer, welches durch den umfangreichen herrlichen Wintergarten noch räumlich erweitert wird. Das Untergeschoss überrascht mit zwei weiteren Zimmern sowie mit einer Toilette und dem geräumigen Hobbyraum mit Ausgang in den Garten. Vier Aussenparkplätze stehen für die Fahrzeuge bereit. Diese einzigartige Immobilie eignet sich perfekt für Familien mit Platzbedarf, als Generationenhaus oder zum Wohnen und gleichzeitig Vermieten.;9 rooms;210m²;CHF 1,250,000.–
Gallusstrasse 67, 4600 Olten;Familienfreundlich, hell - EHP inklusive;;4.5 rooms;106m²;CHF 445,000.–
Römerstrasse 20, 5013 Niedergösgen;Herrschaftshaus in Niedergösgen zu verkaufen;;10 rooms;300m²;CHF 1,495,000.–
In den Reben, 4114 Hofstetten SO;Wohntraum mit Panorama: Ihre Chance, Preis auf Verhandlungsbasis;;8.5 rooms;400m²;CHF 2,398,000.–
Räckholder, 4632 Trimbach;Moderne DEFH mit Weitsicht, Häuser 1 - 6;AllgemeinAn erhöhter Lage mit einer grandiosen Weitsicht entstehen sechs sehr grosszügige Doppelhaushälften in einer modernen und sehr ansprechenden Architektur. Nebst dem Standort überzeugen die Häuser auch mit ihrer Wohnfläche von bis zu 166m² und einem sehr attraktiven Aussenbereich mit einer Terrasse von 72m², welche auf zwei Seiten der Häuser angelegt ist. Die Häuser verfügen über: • Carport mit direktem Hauszugang • zwei Zimmer (beheizt), Technikraum und Waschen/Keller, Luft-Wasser-Wärmepumpe, auf der untersten Ebene • Wohnen/Essen/Kochen und Terrassen auf der mittleren Ebene • 3 Zimmer und 2 Badezimmer auf der obersten Ebene Daten der Häuser 1-6:1: Parz: 286m², NWF: 167m², Kubatur: 928m³, Zimmer: 6½VP CHF 970'000.-2: Parz: 189m², NWF: 167m², Kubatur: 906m³, Zimmer: 6½VP CHF 950'000.-3: Parz: 189m², NWF: 167m², Kubatur: 906m³, Zimmer: 6½VP CHF 950'000.-4: Parz: 200m², NWF: 167m², Kubatur: 906m³, Zimmer: 6½VP CHF 950'000.-5: Parz: 236m², NWF: 167m², Kubatur: 906m³, Zimmer: 6½VP CHF 960'000.-6: Parz: 313m², NWF: 144m², Kubatur: 787m³, Zimmer: 5½VP CHF 950'000.-alle Preise inkl. Carport und ein AussenabstellplatzProjektorganisationBeratung und Verkauf:BCG Behmen Partnership AG, Aarepark 6, 5001 AarauArchitektur:andreas zehnder architekten sia ag, Husmatt2, 5402 DättwilBauleitung:Hasenfratz+Strebel Architekten AG, Wiesenstrasse 1, 4900 LangenthalBauträger:MCO Real Estate AG, Landstrasse 140, 8975 SpreitenbachProjektwebsiteWeitere Informationen finden Sie auch auf der Projektwebsite www.duerrenberg.ch;6.5 rooms;167m²;CHF 950,000.–
Unterbiberiststrasse 12, 4562 Biberist;Moderne Designer-Neubauwohnung mit Aussichtsterrasse;;4.5 rooms;166m²;CHF 1,067,000.–
Vorstadt 13, 4622 Egerkingen;Viel Platz und Spielraum für Ihre Träume;;7 rooms;131m²;CHF 583,000.–
Mittelgäustrasse 124, 4612 Wangen b. Olten;Hammer Preis! Sonnig, hell mit Weitblick ins Grüne;;3.5 rooms;78m²;CHF 305,000.–
Mahrenstrasse 20, 4654 Lostorf;Gepflegt an ruhige Lage mit Fernsicht;;3.5 rooms;63m²;CHF 299,000.–
Engelbergstrasse 7, 4657 Dulliken;Anlageobjekt mit 5 Mietwohnungen;;;;CHF 3,350,000.–
4562 Biberist;Reserviert -Herrliches Einfamilienhaus mit 4.5 Zimmern und Komfort in Biberist;Willkommen in Ihrem neuen Zuhause!Dieses einladende Einfamilienhaus besticht nicht nur durch seine idyllische Lage und Ruhe, sondern auch durch sein modernes und kernsaniertes Interieur. Geniessen Sie das Beste aus beiden Welten  eine entspannte Umgebung und den Komfort einer komplett renovierten Residenz. Dieses Einfamilienhaus bietet Ihnen den idealen Rückzugsort, um dem hektischen Alltag zu entfliehen und gleichzeitig alle Annehmlichkeiten des modernen Lebens zu geniessen.Erleben Sie das harmonische Zusammenspiel von Ruhe, Komfort und Stil  vereinbaren Sie noch heute einen Besichtigungstermin und lassen Sie sich von diesem Traumhaus verzaubern! Dieses properti-Angebot zeichnet sich durch folgende Vorteile aus: • Renoviert im 2018 • Moderner Lebensstil und Funktionalität • Modernes Design und hochwertige Ausstattung für zeitgemässen Wohnkomfort • Nähe zum öffentlichen Verkehr und ÖV, Bequeme Erreichbarkeit • Vier Parkplätze • Entspannen Sie im Grünen und geniessen Sie die Ruhe und Privatsphäre. Interessiert? Kontaktieren Sie uns für ein unverbindliches Gespräch!Möchten Sie selbst eine Immobilie vermarkten? Wir überzeugen mit fairen und transparenten Konditionen!;4.5 rooms;120m²;CHF 700,000.–
Römerstrasse 19, 4512 Bellach;3.5-Zimmer Wohnung - Komplett renoviert und stilvoll ausgestattet;;3.5 rooms;81m²;CHF 440,000.–
Römerstrasse 25, 4512 Bellach;4.5-Zimmer Wohnung in Bellach - Kernsaniert und Exklusiv ausgestattet;;4.5 rooms;109m²;CHF 540,000.–
4412 Nuglar;EINZIGARTIGE ARENA-PERLE;"In der Wohnüberbauung ""Arena"" in Nuglar bieten wir eine architektonisch aussergewöhnliche 6.5 Zimmer Doppelhaushälfte zum Verkauf an. Dieses einladende Zuhause zeichnet sich nicht nur durch seinen heimeligen Innenhof und den grosszügigen Garten aus, sondern auch durch sein umweltfreundliches Heizsystem, das einen Beitrag zur Nachhaltigkeit leistet. • 193 m² Gesamtnutzfläche verteilt auf 6.5 Zimmer, ein Nebenraum und vier Geschosse • Offener, heller Wohn- und Essbereich mit direktem Zugang zum Gartensitzplatz • Grosszügiger, vielseitig nutzbarer Dachstock • Praktische Nebenräume: Waschküche und Wintergarten • Effizientes Heizen mit geringen Umweltauswirkungen dank ökologischer Erdsonde • Ein Aussenabstellplatz sowie ein Velounterstand sind im Kaufpreis inbegriffen Interessiert? Weitere Informationen und Bilder zur Immobilie sowie einen virtuellen Rundgang unter: https://www.propertyowner.ch/immobilien/22-29716/Werden Sie heute noch kostenlos Mitglied im Grundeigentümer Verband Schweiz und profitieren Sie von den zahlreichen Mitgliedervorteilen: www.propertyowner.ch- Verbandsmitglieder können die vorliegende oder andere Immobilien mit Unterstützung unserer Finanzierungsabteilung finanzieren.- Verbandsmitglieder haben Zugang zu unserem Rechtsdienst (30-minütige kostenlose telefonische Erstberatung).- Kostenlose, professionelle Immobilienbewertung- Kostenlose Beratung zur und Berechnung der Grundstückgewinnsteuer";6.5 rooms;162m²;CHF 695,000.–
Rollimatt 1, 4614 Hägendorf;Charmantes Einfamilienhaus mit Baulandreserve;;5 rooms;102m²;Price on request
Bühlstrasse 12, 4614 Hägendorf;Idyllisches 4.5-Zimmer Einfamilienhaus zu verkaufen;;4.5 rooms;130m²;CHF 699,000.–
Karnismatt 590, 4712 Laupersdorf;LANDHAUS ZUM VERLIEBEN SCHÖN;;6.5 rooms;205m²;CHF 975,000.–
Nelkenweg 2, 4533 Riedholz;Grosszügiges Zweifamilienhaus an toller Lage;;7.5 rooms;188m²;CHF 750,000.–
Gwiedemgut 37, 4468 Kienberg;3 Wohneinheiten mit Lager / Werkstatt;;;;CHF 1,500,000.–
2540 Grenchen;Zentrales MFH mit solider Rendite;Zentrales MFH mit solider Rendite An zentraler Lage, nah vom Zentrum und öffentlichen Verkehrsmitteln, befindet sich diese tolle Liegenschaft mit solider Rendite.Das Mehrfamilienhaus besteht aus 15 Wohneinheiten welche alle in den letzten Jahren renoviert wurden.Die Wohnungen befinden sich daher in einem guten Zustand. Lassen Sie sich diese einmalige Chance nicht entgehen!!!! Profitieren Sie von diesem Angebot und überzeugen Sie sich selbst! Dieses Casa Vera -Angebot zeichnet sich durch folgende Vorteile aus: • Zentrale Lage in Grenchen • Gepflegte Wohnungen • Teilrenoviert vor 6 Jahren • Balkone • Garten • 1 x 3.5 Zimmerwohnungen • 3 x 3 Zimmerwohnungen • 2 x 2.5 Zimmerwohnungen • 4 x 2 Zimmerwohnungen • 2 x 1.5 Zimmerwohnungen • 3 x 1 Zimmerwohnungen • 1 x Garage • 2 x Aussenparkplätze • Keller • Veloraum • Waschraum • und vieles mehr.... Interessiert? Kontaktieren Sie uns für eine unverbindliche Besichtigung!Sie wollen Ihr Haus oder Ihre Wohnung sorgenfrei verkaufen, aber wissen nicht zu welchen Preis Sie es verkaufen können?Wir sagen Ihnen den aktuellen Marktwert Ihrer Immobilie, diskret und unverbindlich! Haben Sie Interesse an einem ersten kostenlosen und unverbindlichen Informationsgespräch? Zögern Sie nicht und kontaktieren Sie uns.;;;CHF 2,850,000.–
4629 Fulenbach;Modernes 3.5 Zimmer-Wohnjuwel in ruhiger Nähe zum Zentrum von Fulenbach - Einstellhallenplatz inklusive;Entdecken Sie diese einzigartige Immobilie in perfekter Lage in der Nähe des Zentrums. Hier erwarten Sie zahlreiche Annehmlichkeiten und Freizeitmöglichkeiten, die Ihren Alltag bereichern. Die Lage ist unschlagbar: Einkaufsmöglichkeiten, Restaurants, Cafés und ein Park sind nur einen Steinwurf entfernt. Geniessen Sie die Nähe zur Natur und vielfältige Naherholungsgebiete sowie ein Schwimmbad und Sport-Clubs. Ein Fitnesscenter befindet sich ebenfalls in der Nähe. Für Familien sind Schulen und Kindertagesstätten bequem erreichbar. Die Region zeichnet sich durch Steuervorteile, Ruhe und ländliche Atmosphäre aus. Das Wohnzimmer ist dank seiner Fülle an Tageslicht einladend und offen gestaltet. Die Immobilie zeichnet sich durch einen modernen und erstklassigen Ausbaustandard aus, und sie befindet sich in einem beinahe makellosen, neuwertigen Zustand. Die Küche bietet viel Stauraum und eine praktische Kochinsel. Insgesamt handelt es sich um eine grosszügige, moderne, ruhige Immobilie zu einem erschwinglichen Preis. Vereinbaren Sie einen Besichtigungstermin und lassen Sie sich von diesem Juwel überzeugen.Dieses properti-Angebot zeichnet sich durch folgende Vorteile aus: • Perfekte Lage in der Nähe des Zentrums • Vielfältige Einkaufsmöglichkeiten und Restaurants in unmittelbarer Umgebung • Freizeitmöglichkeiten wie Naherholungsgebiete, Park und Schwimmbad in der Nähe • Leicht erreichbare Sport-Clubs, Fitnesscenter und Schulen • Moderner Ausbaustandard und neuwertiger Zustand der Immobilie • Lichtdurchflutetes und offenes Wohnzimmer • Ruhige, ländliche Region mit Steuervorteilen • Grosszügige Wohnfläche und viel Stauraum in der Küche Interessiert? Kontaktieren Sie uns für eine unverbindliche Besichtigung! Selbst eine Immobilie zu vermarkten? Wir überzeugen mit fairen und transparenten Konditionen!;3.5 rooms;78m²;CHF 450,000.–
Wiesenstrasse 9, 2540 Grenchen;NUR 10% EIGENMITTEL: Neubau Wohneigentum - im Herzen von Grenchen;;1.5 rooms;26m²;CHF 225,000.–
2540 Grenchen;Reserviert -Top moderne 3.5-Zimmer Wohnung an bester Lage in Grenchen;"Diese wunderschöne Wohnung hat alles, was das Herz begehrt. Der offene und lichtdurchflutete Wohn- und Küchen-/Essbereich schafft eine einladende und behagliche Atmosphäre. Hier können Sie gemütliche Abende mit Ihren Liebsten verbringen und köstliche Mahlzeiten zubereiten. Die beiden liebevoll gestalteten Schlafzimmer bieten viel Platz für individuelle Einrichtungsideen und laden zum Entspannen und Träumen ein. Besonders beeindruckt der grosszügige Balkon. Hier können Sie die Sonne geniessen, entspannte Stunden verbringen und den Alltagsstress hinter sich lassen. Das moderne Badezimmer punktet mit einer begehbaren Dusche und einem WC, während das zusätzliche Gäste-WC praktischen Komfort bietet. Ein weiterer Pluspunkt dieser Immobilie ist das praktische Kellerabteil. Hier finden Sie Ihre eigene Waschmaschine und einen Tumbler. Der dazugehörige Einstellhallenparkplatz sorgt dafür, dass Ihr Fahrzeug sicher und bequem untergebracht ist. Auch für Fahrräder und andere Utensilien steht Ihnen im öffentlichen Innenbereich ausreichend Raum zur Verfügung. Diese Wohnung wurde mit viel Liebe zum Detail barrierefrei gestaltet und ist somit auch für Menschen mit eingeschränkter Mobilität bestens geeignet. Ein Lift im Gebäude ermöglicht Ihnen einen bequemen Zugang zu Ihrer Wohnung, ohne dass Sie Stufen überwinden müssen. Zudem trägt die Erdsondenheizung nicht nur zum umweltfreundlichen Wohnen bei, sondern sorgt auch für eine behagliche Wärme in den kalten Wintermonaten. Die ideale Lage dieser Immobilie ist ein weiteres Highlight. Das Zentrum von Grenchen (Märetplatz) erreichen Sie bequem in nur gut 8 Minuten, während eine Bushaltestelle an der Kastelsstrasse in unmittelbarer Nähe liegt (ca. 100m entfernt). Somit sind Sie bestens an den öffentlichen Nahverkehr angeschlossen und können die umliegenden Orte problemlos erreichen. Dieses properti-Angebot zeichnet sich durch folgende Vorteile aus: "" Offenen und lichtdurchfluteten Wohn- und Küchen-/Essbereich"" Grosszügiger Balkon"" Eigene Waschmaschine, Tumbler im Keller"" Praktischer Einstellhallenparkplatz"" Barrierefreien Zugang zur Wohnung und Lift im Gebäude"" Umweltfreundliche Erdsondenheizung"" Nahegelegenes Zentrum von Grenchen und gute Anbindung an den öffentlichen Nahverkehr Interessiert? Kontaktieren Sie uns für ein unverbindliches Gespräch! Selbst eine Immobilie zu vermarkten? Wir überzeugen mit fairen und transparenten Konditionen!";3.5 rooms;72m²;CHF 420,000.–
5013 Niedergösgen;Grosszügige 4.5 Zimmer-Eigentumsstandard Wohnung in Niedergösgen mit einem attraktiven Zins von 1.2% für 4 Jahren;Diese atemberaubenden 4.5 Zimmer Eigentumsstandart Wohnung in Niedergösgen Solothurn steht zum Verkauf. Die Wohnung bietet Ihnen viel Komfort und verfügt über ein eigenes Rediut mit Waschmaschine und Tumbler sowie ein Zimmer mit eigener Nasszelle. Die Lage an der Hauptstrasse bietet Ihnen eine gute Anbindung an Einkaufsmöglichkeiten und Dienstleistungen wie Coiffeurstudios. Gerne lade ich Sie zu einer Besichtigung ein, um sich selbst von den Vorzügen dieser Wohnung zu überzeugen. Die Wohnung ist mit einem attraktiven Hypothek Zins von 1.2 % für nächste 4 Jahren zu übernehmen, was will man noch? zögern Sie nicht und lassen Sie sich Beindrucken! Dieses properti-Angebot zeichnet sich durch folgende Vorteile aus: • Viel Komfort und Annehmlichkeiten • Eigenes Reduit mit Waschmaschine und Tumbler • Zimmer mit eigener Nasszelle • Gute Lage an der Hauptstrasse • Gute Anbindung an Einkaufsmöglichkeiten und Dienstleistungen wie Coiffeurstudios • Garage exklusiv für 35.000,00 CHF • Attraktiver Hypothekenzins von 1,2 % für die nächsten 4 Jahre Interessiert? Kontaktieren Sie uns für ein unverbindliches Gespräch! Selbst eine Immobilie zu vermarkten? Wir überzeugen mit fairen und transparenten Konditionen!;4.5 rooms;117m²;CHF 750,000.–
Fliederweg 6, 4528 Zuchwil;Komfortabler Wohnraum an bevorzugter Lage;;4.5 rooms;99m²;CHF 480,000.–
Haupstrasse339 / Schulstrasse, 4234 Zullwil;NEUBAU, MODERNES 4.5 ZIMMER EINFAMILIENHAUS MIT CARPORT;Das Objekt zeichnet sich durch folgende Kriterien aus:- Moderne Architektur- Wärmepumpe- 2 Carport-Parkplätze- Effizienter Grundriss- Individueller Keller Ausbau und Grundriss-Anpassungen;4.5 rooms;125m²;CHF 890,000.–
Fliederweg 6, 4528 Zuchwil;Top-sanierte Wohnung: Perfekte Mischung aus Eleganz und Komfort;;4.5 rooms;100m²;CHF 560,000.–
Bachstrasse 16, 4562 Biberist;NEUBAU MODERN UND NACHHALTIGE ATTIKAWOHNUNG;;4.5 rooms;108m²;CHF 1,029,000.–
Bachstrasse 16, 4562 Biberist;NEUBAU MODERN UND NACHHALTIGE EIGENTUMSWOHNUNGEN;;2.5 rooms;55m²;CHF 357,500.–
Rüdlenweg 1, 4584 Lüterswil;2 EFH mit 5.5 Zimmer inkl. Keller für ab 1'040'000Sfr.;;5.5 rooms;161m²;CHF 1,040,000.–
Allmendstrasse 2, 4500 Solothurn;Neubauwohnung im «chantier» – stilvoll, hochwertig & verkehrsgünstig;;4.5 rooms;141m²;CHF 985,000.–
Allmendstrasse 2, 4500 Solothurn;Stilvoll Wohnen im verkehrsgünstigen & hochwertigen Neubau «chantier»;;4.5 rooms;142m²;CHF 945,000.–
Allmendstrasse 2, 4500 Solothurn;Neubauwohnung im «chantier» – stilvoll, hochwertig & verkehrsgünstig;;3.5 rooms;98m²;CHF 720,000.–
4206 Seewen;Chalet Charme mitten in Seewen;Dieses charmante Chalet mit 6.5 Zimmern präsentiert sich auf einer Grundstücksfläche von 851 m² am Rande von Seewen und ist von einem Garten mit grosser Rasenfläche umgeben.Das Highlight dieser Liegenschaft ist der knapp 30 m² grosse und offene Wohnbereich. Der originale Kachelofen aus dem Baujahr, Wandverzierungen im Bauernhausstil und getäfelte Wände verleihen diesem lichtdurchfluteten Raum viel Charme und einen urchigen Charakter. Geniessen Sie das Beisammensein in der gemütlichen Sitzecke aus Holz oder lassen Sie den Abend auf dem Balkon ausklingen.Weitere Vorzüge dieses freistehenden Einfamilienhauses sind:-viel Stauraum im Estrich und im Dachgeschoss-Einbauschränke-2 Badezimmer-Werkstatt in der Garage-Sitzplatz mit Pergola-grosszügige Rasenfläche zur freien Gestaltung-1 Garage mit direktem Zugang ins Haus-1 freistehende Garage mit elektrischem Garagentor-und vieles mehrDas Grundstück kann teilweise auch für gewerbliche Zwecke genutzt werden.Verwirklichen Sie hier die Wünsche und geniessen Sie zusammen mit der ganzen Familie das gemütliche Chalet-Feeling.;6.5 rooms;110m²;CHF 690,000.–
4565 Recherswil;RUNDUM GLÜCKLICH IN RECHERSWIL;In Recherswil, unweit von Solothurn, erwartet Sie dieses bezaubernde Einfamilienhaus. Das grosszügige Platzangebot und das eigene Gartenparadies machen es zu einem wahrhaftigen Wohlfühlort. • Platzfreiheit garantiert: 177 m² Gesamtnutzfläche verteilt auf 4.5 Zimmer, Nebenräume und drei Geschosse • Wohnzimmer mit bodentiefen Fenstern, hoher Decke und gemütlichem Cheminée • Sehr guter Zustand dank laufenden Renovationen • Helle, weitläufige Zimmer im Dachstock bieten eine angenehme Atmosphäre • Der grosse Gartensitzplatz mit angrenzender Gartenfläche ist ein wahres Paradies im Freien Interessiert? Weitere Informationen, Bilder und einen virtuellen Rundgang zur Immobilie sowie Besichtigungsmöglichkeiten unter: https://www.propertyowner.ch/immobilien/23-72300/Werden Sie heute noch kostenlos Mitglied im Grundeigentümer Verband Schweiz und profitieren Sie von den zahlreichen Mitgliedervorteilen: www.propertyowner.ch- Verbandsmitglieder können die vorliegende oder andere Immobilien mit Unterstützung unserer Finanzierungsabteilung finanzieren.- Verbandsmitglieder haben Zugang zu unserem Rechtsdienst (30-minütige kostenlose telefonische Erstberatung).- Kostenlose, professionelle Immobilienbewertung - Kostenlose Beratung zur und Berechnung der Grundstückgewinnsteuer;4.5 rooms;142m²;CHF 795,000.–
4653 Obergösgen;Eine Oase im Zentrum;Zentral gelegenes, freistehendes Haus mit grossem Grundstück und Ausbaupotenzial. Im Erdgeschoss befinden sich die Küche, das Wohn- und Esszimmer, ein Badezimmer mit Badewanne, ein Schlafzimmer oder Büro sowie ein Reduit. Der grosse Garten ist von dieser Etage aus zugänglich.In den zwei weiteren Obergeschossen befinden sich jeweils 4 Schlafzimmer mit einem eigenen Dusch-WC, ein Waschraum sowie zwei Terrassen. Im Untergeschoss finden Sie den Technikraum, einen Hobbyraum mit Sauna und ein grosses Kellerabteil. Zwei Garagenboxen runden dieses Angebot ideal ab.Dieses freistehende Einfamilienhaus bietet Ihnen nebst grosszügigem Wohnraum auch zahlreiche Annehmlichkeiten für ein komfortables und entspanntes Wohnen.Dieses ImmoSky-Angebot bietet folgende *Mehr Leistung*:+ Grosses Ausbaupotenzial+ Zentrale Lage+ Kinderfreundliche Umgebung+ Grosser Garten+ Bemerkenswerte Terrasse+ Exklusiver Weinkeller+ 2 GaragenboxenMöchten Sie mehr erfahren? Dann zögern Sie nicht und sichern Sie sich Ihren persönlichen Besichtigungstermin. Wir freuen uns auf Ihren Anruf.;7.5 rooms;107m²;Price on request
4612 Wangen b. Olten;Haus sucht liebevolle Hand;Doppeleinfamilienhaus mit grossem Ausbaupotenzial: Beim Betreten der Immobilie gelangen Sie in den Wohn- und Essbereich. Eine in die Jahre gekommene Küche und eine Gästetoilette komplettieren diese Etage.Im Obergeschoss befinden sich drei Schlafzimmer und ein Badezimmer mit Badewanne und Toilette.Im Untergeschoss finden Sie den Technikraum, einen Hobbyraum und den Keller. Zusätzlich gibt es hier einen Waschraum und eine eingebaute Dusche. Zwei Aussenparkplätze sind vorhanden. Eine Erweiterung der Terrasse mit eingebauter Garagenbox ist realisierbar, ebenso wie eine Aufstockung des Hauses.Dieses ImmoSky-Angebot bietet folgende *Mehr Leistung*:+ Ruhige Lage+ Ausbaupotenzial+ 1 Hobbyraum+ 2 Aussenparkplätze+ Anschluss an den öffentlichen Verkehr in GehdistanzErleben Sie die Vielseitigkeit dieser Doppelhaushälfte und vereinbaren Sie einen Besichtigungstermin, um alle Möglichkeiten zu erkunden.;4 rooms;115m²;CHF 440,000.–
4710 Balsthal;Ihr persönliches Paradies gefunden;Haus mit zwei 3.5-Zimmer-Wohnungen auf grossem Grundstück: Ein Juwel mit Potenzial. Dieses in die Jahre gekommene Haus wartet darauf, geliebt und gepflegt zu werden. Die Möglichkeiten sind nahezu unbegrenzt: Renovieren Sie das bestehende Haus und vermieten Sie die beiden Wohnungen, oder planen Sie ein neues Projekt und nutzen Sie das Grundstück für eine Neuentwicklung. Die atemberaubende Aussicht verleiht Sonnenuntergängen eine ganz besondere Bedeutung.Dieses Haus bietet nicht nur vielseitige Möglichkeiten für wohnen und arbeiten, sondern auch eine idyllische Umgebung, um die Natur und die umliegende Landschaft zu geniessen.Dieses ImmoSky-Angebot bietet folgende *Mehr Leistung*:+ Grosses Ausbaupotenzial+ Ruhige Lage+ Grosser Garten+ Exklusive Aussicht Willkommen zu Ihrem neuen Projekt!Möchten Sie mehr erfahren? Dann zögern Sie nicht und sichern Sie sich Ihren persönlichen Besichtigungstermin. Wir freuen uns auf Ihren Anruf.;7 rooms;135m²;Price on request
4710 Balsthal;Vielfältige Möglichkeiten in idyllischer Lage;Vielseitige Möglichkeiten in idyllischer Umgebung. Die zwei 3.5-Zimmer-Wohnungen bieten jeweils 72 m² Wohnfläche, ein Badezimmer mit Badewanne und Toilette, eine geräumige Küche sowie einen Schwedenofen. Ein grosszügiger Garten und die traumhafte Aussicht machen diese Immobilie zu einem kleinen Juwel. Zur Ausstattung gehören ein Keller mit Gewölbe eine Werkstatt, ein Schopf und drei Aussenparkplätze. Die spektakuläre Aussicht rundet dieses Angebot ab und lädt dazu ein, jeden Moment zu geniessen.Ob als Investition oder als Eigenheim, dieses Anwesen bietet vielseitige Möglichkeiten für die Nutzung.Dieses ImmoSky-Angebot bietet folgende *Mehr Leistung*:+ Grosses Ausbaupotenzial+ Ruhige Lage mit herrlicher Aussicht+ Grosser Garten+ 6 % Rendite möglichNutzen Sie diese Gelegenheit, um in eine Immobilie zu investieren, die sowohl Komfort als auch Potenzial bietet.Möchten Sie mehr erfahren? Dann zögern Sie nicht und sichern Sie sich Ihren persönlichen Besichtigungstermin. Wir freuen uns auf Ihren Anruf.;7 rooms;135m²;Price on request
Inkwilerstrasse 26, 4556 Bolken;Heimelige 3.5-Zimmerwohnung im Grünen;;3.5 rooms;53m²;CHF 290,000.–
4513 Langendorf;RUHEOASE MIT POOL;Moderne Architektur mit perfekter Kombination aus Komfort und Stil. Die Wohnfläche umfasst 4.5 Zimmer mit luxuriöser Ausstattung, mit zwei hochwertigen Bädern, darunter ein Familienbad inklusive Dusche und Whirlpool. Eine umweltfreundliche Bodenheizung, betrieben von einer Luft-Wasser-Wärmepumpe, sorgt für optimalen Komfort. Der 20 Meter lange Garten nutzt den Aussenraum optimal aus, während der Carport an der Grundstücksgrenze maximalen Schutz bietet. Besonders hervorzuheben ist der grosszügige Aussenpool mit automatischer Pool-Abdeckung und Solarheizung. Zwei isolierte und hochwertig ausgebaute Kellerräume bieten zusätzlichen Raum für Büro- oder Gästezimmer.Dieses BETTERHOMES-Angebot zeichnet sich durch folgende Vorteile aus:- modernes Design- Gartenterrasse- Carport- helle Räume- E-Auto Anschluss vorhanden- italienisches Natursteindesign- gedämpfter Eichenparkett- Luft/Wasser-Wärmepumpe- Aussenpool vollautomatisiert + Solarzellen- und, und, und ...Interessiert? Kontaktieren Sie uns für eine unverbindliche Besichtigung!Nichts Passendes gefunden? Über 2'300 weitere Angebote unter: www.betterhomes.ch - der Immobilienfairmittler®Selber eine Immobilie zu vermarkten?Profitieren Sie von unserem Know-how: https://www.betterhomes.ch/de/profitierenSie möchten eine Immobilie schätzen lassen?Erfahren Sie jetzt ihren Wert über unsere Gratis-Schätzung, sofort und unverbindlich!https://www.betterhomes.ch/de/knowledge/estimationMehr DetailsLage: ruhigZustand: gutBäder / Nasszellen: 3 (1 x Dusche / Doppel-Lavabo / WC / Whirlpool, 1 x Lavabo / WC, 1 x Lavabo / Waschturm))Heizsystem: Luft/Wasser-Wärmepumpe Öffentliche Verkehrsmittel: Bushaltestelle Langendorf Sunnerain, 200 m / Bahnhof Langendorf, 950 mSchulen: Primarschule, 750 mGeschäfte: Ladendorf Center, 1.2 km / Coop, 650 m;4.5 rooms;155m²;CHF 1,380,000.–
