Address;Title;Description;Rooms;Living Space (sqm);Price
Bornweg 4a, 4654 Lostorf;Modernes, lichtdurchflutetes 6.5 Zimmer Einfamilienhaus  mit großzügiger Aussenterrasse und Garten;Diese moderne, freistehende Einfamilienresidenz liegt an einem malerischen Ort in einer Sackgasse, nur einen kurzen Spaziergang vom Dorfzentrum und Naherholungsgebieten entfernt. Auf einem Grundstück von 690 m2 präsentieren wir Ihnen dieses Anwesen. Beim Betreten des grosszügigen Vorplatzes bietet sich die Wahl zwischen der 30 m2 großen Doppelgarage oder dem Haupteingang, der direkt in den Flur mit ausreichend Platz für eine Garderobe führt. Die Architektur dieses Hauses ist eine gekonnte Verschmelzung aus Funktionalität und Ästhetik. Der Haupteingang führt in einen einladenden Flur, der genügend Raum zur Begrüssung der Familie und Gäste bietet.UntergeschossIm Untergeschoss befinden sich ein geräumiger Hobbyraum, der vollständig ausgebaut wurde und vielseitige Nutzungsmöglichkeiten bietet. Dieser Raum kann als Hobbybereich, zusätzliches Zimmer oder Fitnessraum genutzt werden. Neben diesem Raum liegt eine moderne Nasszelle mit Dusche, Waschbecken und Toilette. Eine massive Treppe führt in das nächste Stockwerk und zum Herzstück des Hauses. ErdgeschossDas sorgfältig geplante Raumkonzept schafft eine klare Abgrenzung zwischen dem geselligen Bereich für Familienaktivitäten und Gäste und den privaten Rückzugsorten im Obergeschoss, was ein Höchstmass an Wohnqualität für zukünftige Bewohner gewährleistet. Auf beinahe 70 m2 Fläche sind das Wohnzimmer, der Essbereich und die Küche grosszügig gestaltet und offen angelegt. Grosse Fensterfronten schaffen ein Gefühl von grenzenloser Weite, öffnen den Blick nach draussen und führen nahtlos auf die 24 m2 grosse Terrasse. Dreifachverglasung erhöht den Wohnkomfort, während im Winter die grossen Glasflächen die Sonnenwärme optimal nutzen. Die Küche ist mit einer Kochinsel und hochwertigen Geräten ausgestattet, was das Gefühl von Exklusivität unterstreicht. Ein separates Zimmer mit Zugang zur Terrasse kann als Büro oder Gästezimmer genutzt werden. Dazu gibt es ein grosses Zimmer mit Schlaf- und Ankleidebereich sowie ein Badezimmer. Ein Highlight auf der Terrasse ist der einladende Whirlpool, der Entspannung und Erholung unter freiem Himmel verspricht. Ergänzend dazu bietet eine stilvolle Pergola eine charmante Überdachung und schafft einen angenehmen Bereich zum Entspannen, Schutz vor Sonne und für gesellige Momente im Freien.ObergeschossIm Obergeschoss befinden sich drei sonnige Zimmer mit grosszügigen Flächen von 14 m2, 11 m2 und 12 m2, die jeweils Zugang zu der weitläufigen 55 m2 grossen Sonnenterrasse gewähren. Diese Räume bieten nicht nur reichlich Platz, sondern auch einen herrlichen Ausblick. Ein helles Badezimmer vervollständigt das Angebot des Obergeschosses. Ausgestattet mit einer Badewanne, einer Toilette, einer Dusche und einem stilvollen Doppelwaschtisch, bietet dieses Badezimmer eine gelungene Mischung aus Luxus und Funktionalität, um den Bedürfnissen der Bewohner gerecht zu werden.AussenbereichDie Gestaltung des Gartens liegt ganz in Ihrer Hand. Das durchdachte, moderne Wohnkonzept macht dieses Anwesen zu einem eleganten und geschmackvollen Zuhause. Hochwertige Ausstattung, zeitgemässe Farben und grosse Fensterflächen sorgen für ein lichtdurchflutetes Ambiente.;6.5 rooms;220m²;CHF 1,780,000.–
Neugasse 6, 4552 Derendingen;Neubau! Exklusive 3.5-Zimmer Attika-Wohnung im Herzen von Derendingen;Neubau! Exklusive 3.5-Zimmer Attika-Wohnung im Herzen von DerendingenIm Jahr 2025 eröffnet sich die Gelegenheit, Teil eines bezaubernden und familienfreundlichen Quartiers zu werden. Hervorstechend ist die grosszügige Terrasse, die an warmen Sommertagen eine reizvolle Kulisse bietet, um den Abend mit einem Glas Wein ausklingen zu lassen.Die Wohnung beeindruckt durch ein helles und offenes Wohnkonzept mit modernem Ausbau, gelegen in einer ruhigen Wohngegend. Das grosszügige Wohnzimmer ist harmonisch mit einem offenen Koch- und Essbereich verbunden, der zu geselligem Beisammensein einlädt. Zwei geräumige Schlafzimmer und ein Badezimmer mit Badewanne und Dusche vervollständigen das Angebot.Die Lage punktet mit Ruhe, Zentralität und Kinderfreundlichkeit, nur wenige Minuten von Schulen, Einkaufsmöglichkeiten und öffentlichen Verkehrsmitteln entfernt. In der gesamten Wohnung haben Sie die Möglichkeit, den Innenausbau nach Ihren individuellen Vorstellungen zu gestalten und somit Ihren persönlichen Wohntraum zu verwirklichen.Zur Wohnung gehört ein Aussenparkplatz sowie drei weitere Parkplätze für Ihre Besucher.Kontaktieren Sie uns jederzeit für genauere Informationen.Wir freuen uns auf Ihre Kontaktaufnahme!Derendingen4552 Derendingen liegt im Bezirk Wasseramt, im Kanton Solothurn. Die Bevölkerung in der politischen Gemeinde Derendingen hat sich in den letzten fünf Jahren um durchschnittlich +0.6% pro Jahr auf 6'641 Einwohner verändert (Stand 31. Dez. 2021). Die Steuerbelastung liegt bei 15.3% (Kanton: 14.6%). Für die letzten fünf Jahre weist die Gemeinde im Durchschnitt eine jährliche Wohnbautätigkeit von 1.3% auf, während die Leerwohnungsziffer aktuell 1.3% beträgt (Stand 1. Jun. 2022). Die Immobilienpreise haben sich in den letzten fünf Jahren um +14.0% verändert (Kanton: +13.5%).;3.5 rooms;66m²;CHF 505,000.–
Neugasse 6, 4552 Derendingen;Neubau! Exklusive 3.5-Zimmer Erdgeschoss-Wohnung im Herzen von Derendingen;Neubau! Exklusive 3.5-Zimmer Erdgeschoss-Wohnung im Herzen von DerendingenIm Jahr 2025 eröffnet sich die Möglichkeit, Teil eines charmanten und familienfreundlichen Quartiers zu werden. Das herausragende Merkmal dieses Wohnraums ist der gemütliche Gartensitzplatz, der an warmen Sommertagen eine reizvolle Gelegenheit bietet, den Abend mit einem Glas Wein ausklingen zu lassen.Diese Wohnung präsentiert ein helles und offenes Wohnkonzept mit modernem Ausbau in einer ruhigen Wohngegend. Das grosszügige Wohnzimmer ist nahtlos mit einem offenen Koch- und Essbereich verbunden, der zum geselligen Beisammensein einlädt. Zwei geräumige Schlafzimmer und zwei Badezimmer, eines mit Badewanne und das andere als Gäste-WC, komplettieren dieses attraktive Angebot.Die Lage zeichnet sich durch Ruhe, Zentralität und Kinderfreundlichkeit aus, nur wenige Minuten von Schulen, Einkaufsmöglichkeiten und öffentlichen Verkehrsmitteln entfernt. Die gesamte Wohnung bietet Ihnen die Möglichkeit, den Innenausbau nach Ihren individuellen Vorstellungen zu gestalten und somit Ihren persönlichen Wohntraum zu realisieren.Zur Wohnung gehört ein Aussenparkplatz sowie drei weitere Parkplätze für Ihre Besucher.Kontaktieren Sie uns jederzeit für weitere Informationen.Wir freuen uns auf Ihre Kontaktaufnahme!;3.5 rooms;92m²;CHF 625,000.–
Bruggweg 8, 4143 Dornach;Zentral gelegen und vielseitig nutzbar - 7 Zi.-Einfamilienhaus;Diese charmante Liegenschaft punktet mit ihrer zentralen Lage, attraktiven Vielseitigkeit und eignet sich ideal für Familien oder als Arbeits- und Wohnraumkombination. Das Grundstück umfasst ein Wohnhaus, ein Nebengebäude, ein Atelier sowie eine Garage und bietet einen tollen Aussenbereich.Das Wohnhaus erstreckt sich über zwei Etagen, plus einem ausgebauten Dachstock mit einer attraktiven Galerie. Zwei separate Hauseingänge ermöglichen die Nutzung als Generationenhaus oder die Kombination von Wohnen und Arbeiten. Mit bis zu 6 Schlafzimmern, 2 Küchen und 4 Bädern bietet die Liegenschaft ausreichend Platz für die ganze Familie. Das Nebengebäude und das Atelier können Sie als Werkstatt oder für Ihre Hobbies nutzen und bietet Ihnen somit flexible Gestaltungsmöglichkeiten.Der grosszügige Aussenbereich ist eine wahre Oase und verfügt über mehrere Sitzplätze, eine Grünfläche und diverse Unterstände. Der Garten ist gegen hinten ausgerichtet und bietet somit Privatsphäre und Ruhe.Ein ausgebauter Gewölbekeller stellt eines der vielen Highlights dieser Liegenschaft dar und bietet Raum für gesellige Zusammenkünfte. Für den weiteren Komfort stehen 3-4 Aussenparkplätze zur Verfügung.Diese Liegenschaft vereint Wohnkomfort mit Flexibilität, bietet Raum für individuelle Lebenskonzepte für Familien, Kreative oder Unternehmer. Wir freuen uns auf Ihre Kontaktaufnahme.Wir wissen Ihre Immobilie zu schätzen.Alle Immobilienangebote finden Sie auf www.team-lindenberger.chVirtuelle Tour: https://my.matterport.com/show/?m=vxh3ox7Ghfx;7 rooms;358m²;CHF 1,590,000.–
Sankt Benediktweg 36, 4228 Erschwil;Modernes 5.5 Zi.Haus im Herzen der Natur;"Im naturnahen und idyllischen Erschwil erwartet Sie eine Doppelhaushälfte, die keine Wünsche offenlässt. Erbaut im Jahr 2019, präsentiert sich dieses Schmuckstück in einem makellosen Zustand, als wäre es gerade erst fertiggestellt worden! Highlights dieses avendo Hauses, welches Sie mit dem grossen Südbalkon mit einer pittoresken Aussicht auf Landschaft und Berge beglückt:Hochwertiges Raumwunder: Grosszügige 5.5 Zimmer verteilt auf 137 m² Nettowohnfläche sowie einem 10 m2 Wintergarten und einem Garten mit Gartensitzplatz.Design &amp; Komfort: Eine offene, hochwertige Küche mit extra geräumigen Kühlschrank und mit modernen Bauknecht Geräten trifft auf einen lichtdurchfluteten Wohn- und Essbereich mit Spotbeleuchtung.Entspannung pur: Zwei Badezimmer, wovon eines mit einer schönen Badewanne und separater Dusche, eines mit Dusche plus ein Gäste-WCEnergieeffizienz: Dank Luft-Wasser-Wärmepumpe und Bodenheizung sowie einem hochwertigen Isoliersteinmauerwerk geniessen Sie stets ein angenehmes Raumklima und sparen bei den Energiekosten bares Geld.Einzigartige Extras: - Wintergarten, der sich ideal auch als Esszimmer eignet- beheizter Kellerraum mit Fenster, der als Hobbyraum genutzt werden kann- Einstellhallenplatz mit der Möglichkeit auf einen zweiten- Hochwertige Bauweise mit Isolierstein, viele Steckdosen und Details wie Granitfensterbänke, Granittreppe heben das Haus auch im Detail von anderen ab.Gute Lage:- Idyllisch ruhig im Grünen- Volg und Bushaltestelle quasi vor der Haustür- Stadt Laufen keine 6 km entferntDie südausgerichtete Überbauung St. Benedikt fügt sich harmonisch in die ländliche Umgebung ein. Jedes der sechs Doppelhäuser verfügt über einen eigenen Zugang zur Tiefgarage. Geniessen Sie hier sonnige Stunden auf Ihrem weitläufigen Balkon oder relaxen Sie in Ihrem Garten.Lassen Sie sich von der hohen Bauqualität, dem hochwertigen Ausbau und den vielen liebevollen Details dieses avendo Hauses begeistern! Hier finden Sie ein Zuhause, in welches Sie sich jeden Tag aufs Neue verlieben werden!";5.5 rooms;137m²;CHF 890,000.–
Unterdorfstrasse 14a, 4143 Dornach;Verlockendes Eigenheim;Zum Verkauf steht ein charmantes 5½ Zi.-Einfamilienhaus in der begehrten Gemeinde Dornach SO. Das Haus bietet ein umfangreiches Potenzial und eignet sich ideal für Käufer, die ihre kreative Vision verwirklichen möchten. Hier besteht die Möglichkeit, Ihr Zuhause zu gestalten und Ihren persönlichen Stil einzubringen.Das Erdgeschoss des Hauses verfügt über einen grosszügigen Eingangsbereich, drei Zimmer mit Zugang zum Garten, eine Nasszelle und ein Bereich für die Waschküche.Die obere Etage besticht durch einen offenen Grundriss. Hier befinden sich die Küche und der Wohn-/Essbereich und zwei weitere Nasszellen. Mehrere Treppen führen Sie in das Dachgeschoss, das weitere vielseitig nutzbare Räumlichkeiten bereithält. Hier könnten Sie zusätzliche Schlafzimmer, ein Home-Office oder einen kreativen Rückzugsort einrichten. Der idyllische Garten steht zur Mitbenützung zur Verfügung.Dornach ist eine beliebte Gemeinde mit einer hervorragenden Infrastruktur und einer schönen Umgebung. Einkaufsmöglichkeiten, Schulen und öffentliche Verkehrsmittel sind bequem erreichbar. Insgesamt bietet dieses Haus eine fantastische Gelegenheit für Personen, die auf der Suche nach einem Renovationsprojekt mit Gestaltungsfreiraum sind. Zögern Sie nicht, uns zu kontaktieren, um weitere Informationen zu erhalten oder einen Besichtigungstermin zu vereinbaren. Wir stehen Ihnen gerne zur Verfügung, um Sie bei diesem aufregenden Projekt zu begleiten.Wir wissen Ihre Immobilie zu schätzen.Alle Immobilienangebote finden Sie auf www.team-lindenberger.chVirtuelle Tour: https://my.matterport.com/show/?m=TB7v8dFearb;5.5 rooms;152m²;CHF 835,000.–
Breitenbachstrasse 3, 4227 Büsserach;Entdecken Sie Ihre Möglichkeiten in Büsserach;Dieses 5 Zi.-Einfamilienhaus befindet sich an einer zentralen Lage in Büsserach und besticht durch die idyllische Umgebung direkt am Ufer des Flusses Lüssel. Der Eingangsbereich verfügt über einen grosszügigen Vorplatz mit Reduit. Das Erdgeschoss umfasst zwei weitere Zimmer, eine Küche und einen Zugang zum überdachten Sitzplatz und Terrasse mit Blick auf den Gartenbereich. Der Garten erstreckt sich entlang des Flusses Lüssel und bietet eine private Oase. Das Obergeschoss beeindruckt mit drei weiteren Zimmern, die flexibel als Schlafzimmer, Büro oder Gästezimmer genutzt werden können. Ein Badezimmer mit Dusche sorgt für Komfort und Funktionalität. Auch auf dieser Etage können Sie gemütliche Abende auf dem Balkon verbringen. Der grosse Estrich im Dachgeschoss bietet zusätzlichen Stauraum oder Entwicklungspotenzial nach individuellen Bedürfnissen. Im Untergeschoss finden sich diverse Nebenräume und ein weiteres Badezimmer mit Dusche sowie gelangen Sie von hier aus direkt zum Garten mit einem weiteren gedeckten Sitzplatz. Ein Garagenstellplatz, welcher sich auf der gegenüberliegenden Strassenseite befindet, rundet das Angebot ab.Das Haus bietet eine spannende Möglichkeit für individuelle Modernisierungen und kreative Gestaltungsideen, um das Haus an moderne Wohnansprüche anzupassen und die Vorzüge des ländlichen Lebens am Fluss zu geniessen. Die Bausubstanz des Hauses wurde stets unterhalten, wenngleich der Ausbau nicht mehr dem neuesten Standard entspricht.Lassen Sie sich diese einmalige Gelegenheit nicht entgehen und schaffen Sie sich Ihr Wohntraum in Büsserach. Wir freuen uns auf Ihre Kontaktaufnahme.Wir wissen Ihre Immobilie zu schätzen.Alle Immobilienangebote finden Sie auf www.team-lindenberger.chVirtuelle Tour: https://my.matterport.com/show/?m=mQNAEduUuL1;5 rooms;139m²;CHF 440,000.–
Schachenstrasse 19, 4542 Luterbach;Ruhe und Entspannung: Einladendes Einfamilienhaus in Luterbach;Zu verkaufen: Exklusives Einfamilienhaus mit hohem Ausbaustandard und einzigartigem Ambiente. Willkommen zuhause! Dieses wunderschöne Einfamilienhaus mit ihrem herausragenden Ausbaustandard und einzigartigen Annehmlichkeiten steht ab sofort zur Verfügung bereit. Die Wohnung befindet sich in einem charmanten Mehrfamilienhaus mit insgesamt drei Wohneinheiten, diese kann man auch problemlos zu einer Wohneinheit verbinden. Die Hauptwohnung erstreckt sich über großzügige 96 m² Wohnfläche und wurde bis ins kleinste Detail mit hochwertigen Materialien ausgestattet. Beim Betreten der Wohnung wird Ihnen sofort der stilvolle und einladende Wohnbereich ins Auge fallen. Hier sorgt ein gemütliches Cheminée für das perfekte Ambiente und verleiht jedem Abend eine besondere Atmosphäre. Freuen Sie sich auf ein außergewöhnliches Highlight im Umschwung dieser Wohnung: Ein eigenes Badefass im Garten steht Ihnen exklusiv zur Verfügung. Tauchen Sie ein in pure Entspannung und gönnen Sie sich erholsame Momente in Ihrem eigenen privaten Wellnessbereich. Das Badefass bietet Ihnen die Möglichkeit, sich in warmem Wasser treiben zu lassen und dabei die idyllische Umgebung zu genießen. Verabschieden Sie sich vom Stress des Alltags und lassen Sie sich von der beruhigenden Wirkung des Wassers umhüllen. Ein privates Badefass im Garten ist ein Luxus, den Sie in dieser exklusiven Wohnung erleben können. Das Haus verfügt über einen besonderen Komfort: Eine moderne Klimaanlage ist bereits vorhanden. Genießen Sie selbst an heißen Sommertagen ein angenehmes Raumklima und sorgen Sie für eine individuelle Wohlfühlatmosphäre in Ihrer neuen Zuhause. Die Klimaanlage ermöglicht Ihnen die Regulierung der Raumtemperatur ganz nach Ihren persönlichen Bedürfnissen. Kommen Sie nach Hause und entspannen Sie in einem angenehm gekühlten Wohnbereich, eine wahre Erfrischung für Körper und Geist. Ein weiteres Highlight ist die moderne Gastronomie Küche, die selbst den anspruchsvollsten Hobbykoch begeistern wird. Hier können Sie Ihre kulinarischen Kreationen mit Leichtigkeit verwirklichen. Die Küche bietet zudem viel Stauraum und eine erstklassige Ausstattung. Für Ihre Fahrzeuge stehen ein Aussenparkplatz sowie eine Garage zur Verfügung. Zusätzlich gibt es auch einen Anhängerplatz, der Ihren Bedürfnissen gerecht wird. Die Wohnung ist mit isolierenden Fenstern und Storen ausgestattet, die für eine optimale Wärme- und Schalldämmung sorgen. Dank der Photovoltaikanlage und der hervorragenden Isolierung sind die Nebenkosten sehr niedrig, was Ihnen eine große finanzielle Entlastung bietet. Die Lage ist ideal für Familien geeignet, mit einer guten Anbindung an den öffentlichen Verkehr und in der Nähe von Kindergärten und Schulen. Sie können bequem alle notwendigen Einrichtungen erreichen, während Sie dennoch von einer ruhigen Umgebung profitieren. Verpassen Sie nicht die Chance, in dieser einzigartigen Liegenschaft mit hohem Ausbaustandard, Klimaanlage und eigenem Badefass im Garten zu leben. Kontaktieren Sie uns noch heute, um einen Besichtigungstermin zu vereinbaren. Wir freuen uns darauf, Ihnen dieses traumhafte Zuhause präsentieren zu dürfen!;7.5 rooms;172m²;CHF 1,050,000.–
Besenvalstrasse 90, 4500 Solothurn;Parterre-Wohnung an privilegierter Lage in der Stadt Solothurn mit 2 Sitzplätzen;Lage, Lage und nochmals Lage: Genau an dieser privilegierten Lage befindet sich diese 5 ½-Zimmer-Parterre-Wohnung direkt neben dem St. Katharinen-Friedhof im Nordosten der Barock-Stadt Solothurn. Die Familien-Wohnung besticht durch die lichtdurchfluteten Räume und den modernen, offenen Grundriss. Die riesige Gartenterrasse im Süden und ein Schattenplätzchen im Norden sind als Sondernutzungsfläche für Sie reserviert.Das 1997 erstellte Mehrfamilienhaus mit 5 Parteien (6 Stockwerkeinheiten) liegt an bester und ruhiger Lage in der wunderschönen Barockstadt Solothurn. Einkaufsmöglichkeiten, öffentlicher Verkehr und Schulen sind mühelos in wenigen Gehminuten erreichbar. Die Lage neben dem St. Katharinen-Friedhof mit all seinen schönen Plätzen und Wegen – umringt von einem schönen Baumaltbestand – kann als äusserst ruhig bezeichnet werden.Treten Sie ein: Gleich im Korridor lassen sich Ihre Kleider in der Garderobe verstauen. Links befindet sich ein ansprechendes Gäste-WC. Ein paar Schritte weiter gelangen Sie in den äusserst grosszügigen Wohnbereich mit dem Cheminée im Zentrum. Mit grossen Fensterfronten bildet der Wohnraum das Herzstück der Parterre-Wohnung und macht es zusammen mit der grossen Gartenterrasse zu einer exklusiven Wohlfühloase. Das angrenzende Zimmer wurde als Büro offen gestaltet. Nordseitig liegt die Küche mit Bar und grosszügigem Essplatz. Im heissen Sommer findet sich dort der zweite, schattige Sitzplatz. Eingangs des Flurs gegen den Schlaftrakt liegt links die Dusche mit Lavabo. Auf der rechten Seite befinden sich zwei Schlafzimmer. Am Ende des Flurs sind das Bad und gegen Süd-Westen das grössere Elternschlafzimmer angeordnet. Auch vom Elternzimmer gelangt man bequem auf den grossen Gartensitzplatz mit eingefriedeter Sondernutzung.Ein grosser, eigener Waschraum und ebenfalls ein riesiger, eigener Kellerraum sowie ein Carport-Platz runden das tolle Angebot ab.Die Verhandlungsbasis liegt bei CHF 1'080'000.00 plus CHF 40'000 für den Carportplatz, total CHF 1'120'000.00. Zögern Sie nicht - kontaktieren Sie uns per Kontaktformular - wir stellen Ihnen gerne unsere ausführliche Verkaufsdokumentation zu. Danach zeigen wir Ihnen die Wohnung gerne einzeln und persönlich - wir freuen uns auf Sie.Sie beabsichtigen, Ihre bisherige Immobilie zu veräussern? Gerne beraten wir Sie hierzu kostenlos.Ihr regionaler Immobilienpartner - Grun Immobilien AG Obergerlafingen, Marco Grun und Manuela Ruf;5.5 rooms;136m²;CHF 1,080,000.–
Erlenstrasse 11, 4563 Gerlafingen;Ruhig gelegene 3.5-Zimmer-Wohnung;Von der Quartierstrasse aus führt der Weg direkt auf den grosszügigen Parkplatz, vorbei an den Garagen und dem Haupteingang der Liegenschaft. Der Zugang erfolgt über das Treppenhaus, das zwar ohne Lift ausgestattet ist, jedoch einen bequemen Aufstieg ins Erdgeschoss ermöglicht. Hier befindet sich der Eingang zur charmanten 3.5-Zimmer-Gartenwohnung, welche durch ihre Gestaltung und Lage einen einladenden und zugleich gemütlichen Wohnraum bietet. Zusätzlich gehört zur Wohnung, eine Garage sowie einen Aussenparkplatz (welche für CHF 35`000.- dazugekauft werden muss), um Ihren Komfort und Ihre Mobilität weiter zu optimieren.Erdgeschoss Durch die einladende Eingangstür treten Sie in den geräumigen Korridor ein. Bereits auf der linken Seite finden Sie das behagliche Kinderzimmer mit grosszügigen 10 m². Angrenzend daran liegt das komfortable Elternschlafzimmer, welches mit einem eigenen Badezimmer ausgestattet ist ? eine Wohlfühloase mit Badewanne, Waschbecken und Toilette.Zurück im Korridor fällt Ihr Blick auf die Gästetoilette mit Dusche, Toilette und einem eleganten Waschbecken. Diese bietet sowohl Gästen als auch Bewohnern ein Höchstmass an Komfort und Funktionalität. Der Flur führt Sie weiter in das Herzstück der Wohnung: das grosszügige Wohnzimmer mit beeindruckenden 25 m². Hier können Sie sich nach einem langen Tag entspannen und gemütliche Stunden verbringen.Vom Wohnzimmer aus erreichen Sie die gut durchdachte Küche, die nicht nur ausreichend Platz für einen Esstisch bietet, sondern auch einen direkten Zugang zum einladenden Sitzplatz im Freien ermöglicht. Diese Verbindung von Küche und Aussenbereich schafft eine wunderbare Atmosphäre für gesellige Zusammenkünfte und angenehme Mahlzeiten im Freien. In dieser Wohnung kommt durch die geschickte Raumaufteilung und die harmonische Verbindung von Innen- und Aussenbereich wahres Wohnvergnügen auf.DachgeschossIm Dachgeschoss der Liegenschaft befindet sich das Estrichabteil, welches exklusiv zur Wohnung gehört. Dieser geräumige Dachboden bietet Ihnen die Möglichkeit, zusätzlichen Stauraum zu nutzen und persönliche Gegenstände sicher und bequem zu lagern.Untergeschoss Im Untergeschoss befindet sich der zur Wohnung gehörende Kellerraum, der nicht nur zusätzlichen Stauraum bietet, sondern auch über einen direkten Zugang zum Parkplatz verfügt. Diese praktische Anbindung erleichtert das Be- und Entladen sowie den Zugang zu persönlichem Eigentum im Kellerbereich. Zögern Sie nicht und erleben Sie persönlich den Charme dieser einzigartigen Gartenwohnung. Vereinbaren Sie noch heute Ihren individuellen Besichtigungstermin und entdecken Sie, warum dieses Zuhause perfekt zu Ihnen passt.Für zusätzliche Informationen verlangen Sie die ausführliche Verkaufsdokumentation.;3.5 rooms;80m²;CHF 395,000.–
Sandhogerweg 2, 5746 Walterswil SO;Charmante 3.5 Zimmer Dachwohnung mit Weitsicht;Diese charmante 3.5 Zimmer-Eigentumswohnung präsentiert sich in sehr harmonischer Architektur mit vielen Fenstern, welche die Innenräume mit reichlich Licht durchfluten. Der Innenausbau entspricht einem guten Eigentums-Standard. Ein Balkon mit Weitsicht lädt zum Verweilen ein, von hier aus geniesst man atemberaubende Sonnenaufgänge wie auch Sonnenuntergänge. Die eigene Waschmaschine sowie die moderne Küche mit Geschirrspülmaschine lassen Eigentümerherzen höherschlagen. Kurzum, ein Zuhause zum Wohlfühlen.Haben wir Ihr Interesse geweckt? Dann zögern Sie nicht uns zu kontaktieren. Auf Anfrage senden wir Ihnen gerne das ausführliche Verkaufsdossier zu.Gerne überzeugen wir Sie auch vor Ort bei einer unverbindlichen Besichtigung.Noch nicht das passende Objekt? Weitere interessante Objekte finden Sie auf: franzi-immobilien.chSie möchten eine eigene Immobilie verkaufen und suchen dazu einen passenden Immobilienmakler? Profitieren Sie von unserer langjährigen Erfahrung und unserem weitreichenden Netzwerk: franzi-immobilien.ch/vermarktung-wohneigentum/Möchten Sie eine Immobilie schätzen? Über unser Gratis-Schätztool erhalten Sie mit nur wenigen Klicks sofort eine erste unverbindliche Bewertung Ihrer Liegenschaft: franzi-immobilien.ch/immobilien-schaetzungen/online/;3.5 rooms;79m²;CHF 515,000.–
Alpenstrasse 32, 2540 Grenchen;Mehrfamilienhaus in Grenchen mit 15 Wohnungen zu verkaufen!;Die Liegenschaft Alpenstrasse 32 in 2540 Grenchen wurde im Jahr 1929 errichtet und umfasst ein Volumen von insgesamt 2'895 m3. Seither wurden die Objekte fortlaufend renoviert und saniert. Einkaufsmöglichkeiten, Schulen, Restaurants und öffentlicher Verkehr befinden sich alle in bequemer Gehdistanz.Aufteilung der Objekten: • 2x Studio • 1x 1- Zimmerwohnung • 2x 1.5 -Zimmerwohnung • 4x 2- Zimmerwohnung • 2x 2.5- Zimmerwohnung • 3x 3- Zimmerwohnung • 1x 3.5- Zimmerwohnung • 2x Parkplatz • 1x Garage Die allgemeine Vermietung der Objekte läuft immer sehr reibungslos.Mietzinseinnahmen Jährlich: CHF 128'730.00Verkaufspreis: CHF 2'650'000Für weitere Fragen oder Unterlagen stehen wir Ihnen gerne zur Verfügung.Wir freuen uns auf Ihre Kontaktaufnahme.;;;CHF 2,650,000.–
