Address;Title;Description;Rooms;Living Space (sqm);Price
Randenstrasse, 8200 Schaffhausen;Einzigartige Neubau Eigentumswohnung auf der Breiti;;3.5 rooms;115m²;CHF 1,120,000.–
8219 Trasadingen;Einfamilienhaus in Trasadingen;;5.5 rooms;144m²;CHF 1,198,000.–
Im Baumgarten 2, 8262 Ramsen;Eleganz auf dem Land - Luxuriöse Eigentumswohnungen;;3.5 rooms;92m²;CHF 670,000.–
Im Wölfli, 8240 Thayngen;Sonnige Aussichten mit hochwertigem Ausbau;;4.5 rooms;149m²;CHF 975,000.–
Haingartenstrasse, 8215 Hallau;4.5 Zimmer Eigentumswohnung 1. / 2. Dachgeschoss;;4.5 rooms;171m²;CHF 750,000.–
Neuwis 3, 8236 Büttenhardt;80% Steuern sparen bei PK Bezug mit Wohnung in SH - 212m2 Attika als Basis !;Baustart ist erfolgt !Im Kanton Schaffhausen werden PK-Bezüge mit maximal 6% besteuert - im Kanton Zürich mit bis zu 22.4% und mehr - bei 2 Mio Bezug aus der PK (16.09% im Kanton ZH) bereits ein Unterschied von mehr als CHF 200'000. Fragen Sie uns danach, wir unterstützen Sie bei der Suche nach einem professionellen Steuerberater der diese Fragen für Sie individuell beantworten kann. Nur 35 Minuten vom Flughafen Zürich (oder 45 Minuten zum HB ZH) und in direkter Nähe zu Autobahn-Anschluss (4 Minuten), Schulen und Einkaufsmöglichkeiten (MMMigros in 5 Minuten) erstellen wir in der sonnigsten Schaffhauser Gemeinde auf 700m über Meer neue Eigentumswohnungen. Das Projekt zeichnet sich durch eine äusserst ruhige und sehr sonnige Lage mit unverbaubarer Aussicht aus. Nachhaltige Bauweise mit lokalen Partnern, clevere Grundrisse und faire Preise runden das Angebot ab.Diese grosszügige und raffiniert gestaltete 4.5-Zimmer Dach-Wohnung raubt Ihnen den Atem: Sie leben auf der gesamten Grundfläche des MFH im obersten Geschoss. Neben 2 Dachterrassen, Raumhöhen bis 3.9m und einem direkten Zugang zur Wohnung mit dem Lift (Optional auch via Treppenhaus) überzeugt die Wohnung mit vielen weiteren Details. Schwellenloser Zugang sind genauso selbstverständlich wie eine offene Küche. Geniessen Sie aus allen Räumen den unverbaubaren Ausblick ins Grüne oder in die Alpen. Massive Bauweise und höchste Anforderung an Schalldämmung und Isolation lassen Sie jederzeit ruhig schlafen. Selbstverständlich haben Sie als Käufer freie Wahl bei Ausbau und Gestaltung. Teil des Miteigentums ist ein über 1500m2 grosser Park mit alten Obstbäumen - welcher gemeinsam von allen Eigentümern genutzt werden kann. Allgemeine Informationen:Allgemeine Informationen:Wir legen grossen Wert auf nachhaltige Planung - auch zu Gunsten Ihrer Investition. Wir bauen bewusster - damit Sie in Zukunft tiefere Kosten haben: Die hinterlüftete Fassade benötigt kaum Unterhalt, die PV Anlage reduziert ihre Stromkosten, das Steildach wird ihnen weniger Sorgen bereiten als ein Flachdach - und das Minergie-Label in Kombination mit der Komfortlüftung optimiert ihren Energieverbrauch. Alle Wohn-Einheiten sind über eine gemeinsame Tiefgarage erschlossen. Vorbereitungen für E-Mobilität (Bikes und Autos) sind selbstverständlich, gute Budgets für Bäder und Küchen (VZug) ebenso. Geheizt wird nachhaltig mit Hackschnitzeln aus den lokalen Wäldern (Fernwärme). Jedes Haus bildet eine in sich geschlossene STWE-Gemeinschaft. Zu jeder Wohnung gehört ein eigener Keller-Raum und das Nutzungsrecht an einem Trocken-Raum pro MFH. Tiefgaragenplätze oder abschliessbare Garagen können ab CHF 29’000 erworben werden, ebenfalls stehen Hobbyräume (belüftet und mit Wasser-Anschluss) zum Kauf. Büttenhardt liegt 700m über Meer und direkt am Stadtrand von Schaffhausen. Die Gemeinde hat sich in den letzten Jahren sehr gesund entwickelt (keine Schulden, aktuell im kantonalen Steuervergleich auf dem vierten Platz mit sehr guten Perspektiven) und freut sich über Zuzüger. Sie leben direkt im Naherholungsgebiet mit Bike-Trails und Wanderwegen sprichwörtlich vor der Haustüre...aber nicht nur: Das Multiplex-Kino liegt nur 4 Minuten, Theater und Konzerte 8 Minuten entfernt. Sie finden alle Unterlagen, Details und Preise auf unserer Projektseite 8236.ch - für Fragen, weitergehende Informationen oder einen Besuch vor Ort stehen wir Ihnen sehr gerne zur Verfügung. Unser Finanzierungspartner (Schaffhauser Kantonalbank) und die UBS kennen die angebotenen Wohnungen und erstellen Ihnen auf Basis der anerkannten Verkaufspreise gerne eine Finanzierungsofferte. Weitere Referenzen (Banken) nennen wir Ihnen gerne auf Wunsch und unterstützen Sie bei allen anderen Fragen zu einer möglichen Finanzierung.PS: Spätestens bei einem Besuch vor Ort werden Sie über die Nähe erstaunt sein - und unseren Claim (leben.schön.nah) bestens nachvollziehen können. Wir freuen uns auf Sie!;4.5 rooms;212m²;CHF 1,450,000.–
Wiesentalstrasse 8, 8215 Hallau;Immobilie mit Stil angrenzend an Landwirtschaftszone;;4.5 rooms;125m²;CHF 760,000.–
Zelgliweg, 8236 Büttenhardt;80% Steuern sparen bei PK Bezug in SH mit Kauf 2.5 Zimmer Wohnung;;2.5 rooms;60m²;CHF 459,000.–
Geerenweg 8, 8226 Schleitheim;Bauernhaus in Schleitheim;;6 rooms;167m²;CHF 1,130,000.–
Weinbergstrasse 10, 8212 Neuhausen am Rheinfall;five corners - Jetzt letztes Atelier reservieren!;Hoch hinaus vereint mit modernem Wohnen für jeden Anspruch - Das Neubauprojekt «five corners» Neuhausen am Rheinfall macht es möglich.Per Herbst / Winter 2024 entstehen insgesamt 48 qualitativ hochwertig ausgestattete Eigentumswohnungen sowie 2 Wohnateliers und eine Retailfläche im Erdgeschoss. Ausstattung der Wohnungen:- attraktive Grundrisse- teilweise überhohe Räume- optimale Integration der Küchen in den Wohn-/Essbereich- moderne Küchenausstattung mit Induktionskochfeld- Nasszellen mit Badewanne oder Duschbereich- Wohn-/ und Essbereich mit Parkettboden- Reduit mit Waschturm- Wärmeerzeugung erfolgt mittels Fernwärme / Wärmeverteilung über Fussbodenheizung Die Highlights von «five corners»- ruhig und naturnah in einem Katzensprung am Rheinfall- Öffentlicher Verkehr in Gehdistanz- Wunderschöne Umgebung mit Sitzbänken und Brunnen Die Toplage von «five corners» bietet:- Öffentliche Verkehrsmittel, Busstation in unmittelbarer Nähe- In Gehdistanz: Einkaufsmöglichkeiten, Bäckerei, und Restaurant- Sportmöglichkeiten wie Vitaparcours Neuhausen, Freibad, Fitness, etc.- Sehr gute Erreichbarkeit nach Zürich- Der Rheinfall lädt zum Verweilen und für schöne Spaziergänge ein Lassen Sie sich inspirieren und konfigurieren Sie Ihre Wohnung ganz nach Ihren Wünschen: www.five-corners-neuhausen.ch/ Vereinbaren Sie noch heute ein individuelles Beratungsgespräch. Wir freuen uns über Ihren Besuch in unserem Showroom.;2.5 rooms;79m²;CHF 499,000.–
Tauchergasse 4, 8226 Schleitheim;Top saniertes Einfamilienhaus mit Einliegerwohnung;;9.5 rooms;260m²;CHF 865,000.–
Steigstrasse 76, 8200 Schaffhausen;Wohnen in Schaffhauser Bahnhofsnähe;Diese neuwertige Maisonette befindet sich in einem charmanten Altbau in unmittelbarer Nähe zur Schaffhauser Altstadt. Die gemütliche, aber dennoch geräumige Wohnung wurde im Jahr 2022 umfassenden renoviert und bietet den perfekten Mix aus modernem Komfort und historischem Flair.Die Maisonette bietet Ihnen ausserdem: • Offenen Küchen-, Wohn- und Essbereich mit hohen Decken • Strahlender Parkettboden in allen Zimmern • Gut ausgestattete Küche mit eleganter Eichenholz-Bartheke • Ein vollausgebautes Badezimmer mit Dusche, Lavabo mit Unterbau, Spiegelschrank und Toilette sowie ein Gäste-WC mit Lavabo und Toilette • Einladender Balkon mit süd-östlicher Ausrichtung • Waschmaschine und Tumbler Die Wohnung wird über eine effiziente Gasheizung mit Radiatoren beheizt. Zusätzlich zur Wohnung haben Sie die Möglichkeit, eine private Garagebox (CHF 30'000.-) zu erwerben, die sich in unmittelbarer Nähe zur Wohnung befindet.Diverse Einkaufs- und Freizeitmöglichkeiten, ÖV-Haltestellen, der Bahnhof Schaffhausen sowie die Schaffhauser Altstadt sind in wenigen Gehminuten erreichbar.Weitere spannende Angaben zu dieser einzigartigen Immobilie erhalten Sie auf Anfrage oder an einer unverbindlichen Besichtigung Ihres neuen Zuhauses.Sie können es gar nicht mehr abwarten, mehr zu erfahren? Dann zögern Sie nicht und nehmen Sie noch heute mit uns Kontakt auf. Wir freuen uns auf Sie!;4.5 rooms;140m²;CHF 890,000.–
Dorfstrasse 9, 8261 Hemishofen;Künstlerhaus mit Einliegerwohnung und Atelier, nahe dem Rhein;In Rheinnähe, Künstlerhaus mit Einliegerwohnung und AtelierDieses spannende Haus liegt wenige Gehminuten vom Rhein entfernt und bietet vielfältige Nutzungsmöglichkeiten. Hier nur einige Punkte wieso dieses Haus ideal zu Ihnen passen könnte: • sonniger Garten und kleine Terrasse unweit des Rheins • spannender, nicht 0815 Grundriss • freistehendes Cheminée • moderne Küche • helles, grosses Schlafzimmer auf zwei Ebenen • kultige Einliegerwohnung • grosszügiges Atelier mit überhohen Decken • Gewölbekeller • zentrale Lage im Dorf, Fussweg zum Rhein Für Fragen oder einen unverbindlichen Besichtigungstermin stehen wir Ihnen sehr gerne zur Verfügung. Wir freuen uns auf Sie! Ellen Testi;7 rooms;280m²;CHF 950,000.–
Espiligartenweg 6, 8226 Schleitheim;7.5-Zimmer-Haus mit Photovoltaik und E-Ladestationen, tolle Raumaufteilung;Grosses Familienhaus im GrünenDieses ungemein gemütlich Haus an sehr sonniger Lage wird Ihr Herz höherschlagen lassen. Hier nur einige Punkte, was diese Liegenschaft so einzigartig macht: • Familienhaus im bündner Stil mit viel Flair • überdurchschnittlich grosse Nettowohnfläche • grosser, auch für Tierhaltung sehr geeigneter Garten • ruhige, idyllische Lage mit Weitsicht • gedeckter Sitzplatz und Laube • Holzofen in der Küche • Cheminée im Wohnzimmer • zwei Badezimmer • begehbarer Kleiderschrank • Sauna • Holzstückheizung, Bodenheizung und Radiatoren • Photovoltaikanlage 2.34 KWp • Solaranlage • zwei E-Ladestationen • grosse Werkstatt • Doppelgarage Gerne führe ich Sie durch diese schöne Liegenschaft und zeigen Ihnen, warum dies Ihr Traumhaus sein könnte.Ich freue mich auf Sie!Herzliche Grüsse und bis baldEllen Testi;7.5 rooms;207m²;CHF 1,190,000.–
Badische Bahnhofstrasse 16, 8212 Neuhausen am Rheinfall;RhyfallTower - herausragend wohnen;Auf historischem Grund entsteht der imposante RhyfallTower als Herzstück eines lebendigen Quartiers in Neuhausen am Rheinfall. Er bietet eine neue Lebenswelt an exklusiver Lage, direkt über dem grössten Wasserfall Europas. Die exklusiven Eigentumswohnungen im RhyfallTower mit ihren 5.5 Zimmern bieten Ihnen jede Menge Komfort und ein einmaliges Wohngefühl. Verteilt auf herausragende 24 Etagen erwarten Sie grosszügige Grundrisse, lichtdurchflutete Räume sowie eine einmalige Aussicht auf den Rheinfall und die umliegende, weite Landschaft bis in die Alpen.Erleben und sehen Sie sämtliche Materialien, welche Ihre neue Eigentumswohnung auszeichnen und setzen Sie die ersten virtuellen Schritte in Ihre Wohnung, direkt in unserem Showroom vor Ort. Alle Informationen zu den Wohnungen finden Sie auf der Projektwebseite unter www.kaufen.rhyfalltower.ch.Herzliche GrüsseIhr Vermarktungsteam der Tend AG;4.5 rooms;138m²;CHF 1,150,000.–
Badische Bahnhofstrasse 16, 8212 Neuhausen am Rheinfall;RhyfallTower - herausragend wohnen;Auf historischem Grund entsteht der imposante RhyfallTower als Herzstück eines lebendigen Quartiers in Neuhausen am Rheinfall. Er bietet eine neue Lebenswelt an exklusiver Lage, direkt über dem grössten Wasserfall Europas. Die exklusiven Eigentumswohnungen im RhyfallTower mit ihren 5.5 Zimmern bieten Ihnen jede Menge Komfort und ein einmaliges Wohngefühl. Alle noch verfügbaren Wohnungen bieten grosszügige Grundrisse, lichtdurchflutete Räume sowie eine einmalige Aussicht auf den Rheinfall und die umliegende, weite Landschaft.Erleben und sehen Sie sämtliche Materialien, welche Ihre neue Eigentumswohnung auszeichnen und setzen Sie die ersten virtuellen Schritte in Ihre Wohnung, direkt in unserem Showroom vor Ort. Alle Informationen zu den Wohnungen finden Sie auf der Projektwebseite unter www.kaufen.rhyfalltower.ch.Herzliche GrüsseIhr Vermarktungsteam der Tend AG;5.5 rooms;138m²;CHF 1,190,000.–
Meisenweg 15, 8200 Schaffhausen;5.5-Zi-Attikawohnung in unmittelbarer Schaffhauser Bahnhofsnähe;"Willkommen in Ihrer neuen Traumwohnung, nur wenige Gehminuten vom Schaffhauser Bahnhof und der bezaubernden Altstadt entfernt. Diese einladende Attikawohnung zeichnet sich nicht nur durch ihre erstklassige Lage aus, sondern besticht zudem mit ihrer guten Ausstattung und der atemberaubenden Aussicht auf das beeindruckende ""Munot""-Wahrzeichen.Die Maisonette bietet Ihnen ausserdem: • Heller und grosszügiger Wohn- und Essbereich mit schöner Aussicht und heimeligen Cheminée • Weitläufige Terrasse mit faszinierendem Panorama und Aussenkamin für gesellige Stunden • Strahlende und gepflegte Marmorböden • Waschmaschine &amp; Tumbler • Zwei voll ausgestattete Badezimmer mit Dusche, Badewanne, Lavabo, Spiegelschrank und Toilette. Zusätzlich ein Gäste-WC mit Lavabo und Toilette. • Gut ausgestattete Küche mit idyllischem Ausblick ins Grüne Die Wohnung verfügt über drei Schlafzimmer, welche sich auf der rechten Seite des Eingangs befinden. Sie verfügen über helle Teppichböden und grosszügige Fenster wie auch praktischen Einbauschränken. Im oberen Geschoss erwartet Sie eine Galerie sowie ein weiteres Zimmer mit Balkon, welches optimal für Home-Office Tage genutzt werden kann.Weiter können zwei Einstellplätze (je CHF 30'000) wie auch ein Bastelraum (CHF 20'000) erworben werden. Für wohlige Wärme sorgt eine effiziente Gasheizung.In unmittelbarer Nähe finden Sie diverse Einkaufsmöglichkeiten, Restaurants, Schulen und öffentliche Verkehrsmittel. Zudem sind Sie nur einen Katzensprung von Naherholungsgebieten wie dem Rhein und dem Klettgau entfernt.Weitere aufregende Details zu dieser einzigartigen Immobilie erhalten Sie gerne auf Anfrage oder bei einer unverbindlichen Besichtigung. Sie können es kaum erwarten, mehr zu erfahren? Dann zögern Sie nicht und nehmen Sie noch heute Kontakt mit uns auf. Wir freuen uns darauf, Sie in Ihrem neuen Zuhause willkommen zu heissen!";5.5 rooms;230m²;CHF 1,590,000.–
Birchweg 42, 8200 Schaffhausen;Moderne Eigentumswohnung im Talberg;Werden Sie Teil einer Gemeinschaft mit einem zukunftsorientierten Konzept - die moderne und zeitgemässe Architektur überzeugt mit ihrer Geradlinigkeit und Eleganz im Innenausbau.Das Neubauprojekt befindet sich in der Nähe umfassenden Infrastruktur und der Schaffhauser Altstadt.Hier wenige Highlights: • Neubauwohnung mit grosszügiger Terrasse oder Balkon • Befindet sich bereits im Bau und ist bezugsbereit ab Frühling 2025 • Hochwertiger Innenausbau mit Option zur Individualisierung • Reduit und separates Kellerabteil • Tiefgaragenplatz kann für CHF 38'000.- dazu erworben werden • Zugang über Lift Gerne lassen wir Ihnen die detaillierten Verkaufsunterlagen zukommen und stehen Ihnen für ein persönliches Gespräch zur Verfügung.Wir freuen uns auf Ihre Kontaktaufnahme.Ihr Casaly-Team;2.5 rooms;63m²;CHF 535,000.–
Neuhausen am Rheinfall, 8212 Neuhausen am Rheinfall;4.5-Zimmer Wohnung im Rhyfalltower;Diese grosszügige und helle 4.5-Zimmer Wohnung mit Erstbezug im Frühling 2024, liegt im neu erstellten Rhytech-Quartier in Neuhausen am Rheinfall. Einkaufsmöglichkeiten und Gastronomieangebote finden Sie unmittelbar im Rhytech-Quartier. Die Wohnung liegt im 5. Obergeschoss und überzeugt durch ihren hochwertigen Ausbaustandard, die sonnenverwöhnten Wohnräume und einem schönen Weitblick. Weitere Wohnhighlights sind das Vierjahreszeitenzimmer, die offene Küche, zwei Nasszellen mit je einer Dusche oder einer Badewanne sowie das Reduit mit eigenem Waschturm. Die Wohnung mit einer Fläche von 137 m2 bietet rundum viel Wohnkomfort. Zur Wohnung gehört ein Einstellplatz in der hauseigenen Tiefgarage und ein Kellerabteil. Der öffentliche Verkehr, der Rheinfall und das Zentrum sind nur wenige Schritte entfernt.Genaue Adresse verfügbar nach Registrierung auf neho.ch.AN EINER BESICHTIGUNG INTERESSIERT? BITTE ANMELDEN: https://neho.ch/b/8212-24-1;4.5 rooms;137m²;CHF 1,165,000.–
Schaffhausen, 8200 Schaffhausen;Modernisierte 2.5-Zimmer-Wohnung an begehrter Lage;Mit grosser Freude präsentieren wir Ihnen hier eine modernisierte 2.5-Zimmer-Wohnung an ruhiger, attraktiver Lage in Schaffhausen. Das offene Wohn-/Esszimmer mit direktem Zugang zum sonnigen Südwestbalkon, das helle Wohnambiente sowie die hochwertige Küche mit ordentlich Stauraum garantieren ein wunderbares Wohnerlebnis. Das Badezimmer mit begehbarer Dusche und die zahlreichen Einbauschränke komplettieren dieses Angebot ideal. Zögern Sie nicht und kontaktieren Sie uns!Genaue Adresse verfügbar nach Registrierung auf neho.ch.AN EINER BESICHTIGUNG INTERESSIERT? BITTE ANMELDEN: https://neho.ch/b/8200-23-3;2.5 rooms;74m²;CHF 380,000.–
Dorfstrasse 2, 8234 Stetten SH;Charmante Doppelhaushälfte mit modernem Ausbaustandard;Wohnen in Stetten - Kernsaniertes 4.5 Zimmer-Haus mit KomfortWillkommen im Traumhaus: Moderne 4.5-Zimmer-Doppelhaushälfte mit Garten, Balkonen und vielfältigen Nutzungsmöglichkeiten!Diese exklusive Doppelhaushälfte bietet Ihnen nicht nur den perfekten Raum für Ihr neues Zuhause, sondern auch zahlreiche Annehmlichkeiten, die Ihren Wohntraum wahr werden lassen.Die grosszügigen 4.5 Zimmer, verteilt auf zwei Etagen, bieten ausreichend Platz für Familien oder Paare, die Wert auf Komfort legen.Die beiden modernen Badezimmer, eines mit Duschbadewanne und WC, das andere mit Dusche und WC, sind die idealen Orte für Entspannung.Ihre Fahrzeuge finden in der Garage oder auf dem dazugehörigen Abstellplatz Platz. Zwei gedeckte Balkone laden dazu ein, die Sonne zu genießen und die frische Luft auszukosten. Der gemütliche Sitzplatz im Garten ist perfekt für gesellige Abende mit Familie und Freunden.Das Gartenhaus, das für CHF 70'000.- dazu erhältlich ist, bietet nicht nur Stauraum, sondern auch einen eigenen Landanteil ? ideal für Gartenliebhaber. Der ausbaubare Dachstock bietet Ihnen die Möglichkeit, zusätzlichen Wohnraum nach Ihren Vorstellungen zu schaffen.Diese Doppelhaushälfte überzeugt nicht nur durch ihre praktische Aufteilung, sondern auch durch die Vielfalt an Nutzungsmöglichkeiten. Der Garten mit Gartenhaus und Landanteil lässt Raum für kreative Gestaltungsideen, während der ausbaubare Dachstock die Option für eine individuelle Erweiterung des Wohnraums bietet.Haben wir Ihr Interesse geweckt? Vereinbaren Sie noch heute einen Besichtigungstermin.Wir freuen uns auf Ihre Kontaktaufnahme.;4.5 rooms;113m²;CHF 875,000.–
Weinbergstrasse 10, 8212 Neuhausen am Rheinfall;five corners - Jetzt letzte einzigartige Loft reservieren!;Hoch hinaus vereint mit modernem Wohnen für jeden Anspruch - Das Neubauprojekt «five corners» Neuhausen am Rheinfall macht es möglich.Per Herbst / Winter 2024 entstehen insgesamt 48 qualitativ hochwertig ausgestattete Eigentumswohnungen sowie 2 Wohnateliers / Lofts und eine Retailfläche im Erdgeschoss. Ausstattung der Wohnungen:- attraktive Grundrisse- teilweise überhohe Räume- optimale Integration der Küchen in den Wohn-/Essbereich- moderne Küchenausstattung mit Induktionskochfeld- Nasszellen mit Badewanne oder Duschbereich- Wohn-/ und Essbereich mit Parkettboden- Reduit mit Waschturm- Wärmeerzeugung erfolgt mittels Fernwärme / Wärmeverteilung über Fussbodenheizung Die Highlights von «five corners»- ruhig und naturnah in einem Katzensprung am Rheinfall- Öffentlicher Verkehr in Gehdistanz- Wunderschöne Umgebung mit Sitzbänken und Brunnen Die Toplage von «five corners» bietet:- Öffentliche Verkehrsmittel, Busstation in unmittelbarer Nähe- In Gehdistanz: Einkaufsmöglichkeiten, Bäckerei, und Restaurant- Sportmöglichkeiten wie Vitaparcours Neuhausen, Freibad, Fitness, etc.- Sehr gute Erreichbarkeit nach Zürich- Der Rheinfall lädt zum Verweilen und für schöne Spaziergänge ein Lassen Sie sich inspirieren und konfigurieren Sie Ihre Wohnung ganz nach Ihren Wünschen: www.five-corners-neuhausen.ch/ Vereinbaren Sie noch heute ein individuelles Beratungsgespräch. Wir freuen uns über Ihren Besuch in unserem Showroom.;2.5 rooms;79m²;CHF 499,000.–
Hauptstrasse 57, 8217 Wilchingen;Grosse Liegenschaft mit vielen Möglichkeiten;Grosse Liegenschaft mit viel PotentialDiese sehr schöne, charmante Liegenschaft bietet genug Platz für Familie und Hobby und lässt Ihnen viele Möglichkeiten. Hier nur einige Punkte was dieses Haus zu Ihrem optimalen Zuhause macht: • idyllisches Rebbaudorf mit guter Anbindung an den öffentlichen Verkehr • sonnige Lage direkt im Dorfkern • viele charmante, historische Details • grosser Garten auf der Rückseite des Gebäudes • schöner Laubengang mit direktem Gartenzugang • viel Platz für Ihre Individualität, grosszügige Nebenräume Die Liegenschaft untersteht dem Denkmalschutz (kommunal).Geheizt wird mit verschiedenen Holz- und Elektroöfen, ein Anschluss an den Wärmeverbund in Wilchingen ist möglich.Gerne führe ich Sie durch dieses tolle Haus, hätten Sie Zeit für eine Besichtigung? Herzliche Grüsse und bis bald Ellen Testi www.buehrerpartner.ch;8 rooms;216m²;CHF 650,000.–
Dettenwies 6, 8235 Lohn SH;Traumhaftes Einfamilienhaus mit Pool und herrlichem Ausblick zum Verkauf in Lohn!;Willkommen in Ihrem zukünftigen Zuhause! Dieses fantastische EFH befindet sich in Ortsrandlage von Lohn SH in einer ruhigen und malerischen Umgebung. Mit seinen 5.5 Zimmern bietet es Ihnen und Ihrer Familie den idealen Raum, um sich zu entfalten und wohlzufühlen.Im Erdgeschoss, welches überdacht von der Garage erreicht werden kann, befinden sich die Wohnräume und die Haustechnik. Neben einem Gäste-WC im Eingangsbereich geht es in die geräumige und helle Küche, die über eine Schiebetüre vom Essbereich abtrennbar ist. Der Zugang zum Sitzplatz ist perfekt, um in der Morgensonne draussen zu frühstücken. Zwischen Essbereich und Wohnzimmer ist ein wunderschönes Warmluft- Cheminée, das an kalten Tagen für wohlige Atmosphäre sorgt. Vom Wohnbereich kommt man direkt auf die Terrasse, die einen herrlichen Blick in Richtung Westen bietet und mit einem Pavillon überdacht ist. Es gibt zusätzlich einen Nebeneingang- perfekt geeignet- wenn man vom Sport, mit Tieren oder wenn Kinder vom Spielen nach Hause kommen, denn dort ist ein separater Raum mit Hundebadewanne und ein zusätzlicher Nassraum mit Dusche- neben der Haustechnik. Im Zwischenbereich zum Obergeschoss ist ein kleines Atelier und oben dann die Privaträume. Zur Linken sind es ein grosses Büro nach Süden ausgerichtet und zwei weitere Zimmer nach Westen, eines davon mit Ensuite- Ankleide. Das Bad mit Whirlpool Badewanne und Dampf- Aromadusche ist geschmackvoll eingerichtet und bietet genügend Platz.Der Garten des Hauses ist parkähnlich angelegt und äusserst gepflegt, der Pool mit 27m³ ist im Sommer das Highlight und im Gartenhaus können Sie alle Geräte verstauen. In der Garage passen zwei mittelgrosse Autos hinein und eine kleine Werkstatt ist ebenfalls vorhanden.Besonders ist die Technik im Objekt: das Haus wird mit einer Luft-Wasser Wärmepumpe geheizt und die Fassade wurde mit Zellulose komplett gedämmt. Das Haus ist in perfektem Zustand und wurde 2015 umfassend renoviert. Der Pool wird mit einer Sauerstoff Filteranlage gereinigt und noch zusätzlich UV desinfiziert, sodass kein Chlor benötigt wird.Das Haus ist ab Dezember 2024 verfügbar und freut sich auf neue Besitzer, die die Qualität und Ruhe geniessen möchten!;5.5 rooms;166m²;CHF 1,520,000.–
Biberstrasse 125, 8240 Thayngen;Hausteil mit Garten und Sitzplatz in charmantem Zweifamilienhaus;Dieser charmante Hausteil, welcher sich vom Eingangsbereich in eine schöne Dachwohnung erstreckt, befindet sich in einem Zweifamilienhaus an ruhiger Lage mit herrlicher Sicht ins Grüne. Die rustikalen Balken, eine stilvolle Galerie, ein schöner Schwedenofen sowie viele weitere liebevolle Details verleihen dieser Wohnung ihren ganz besonderen Charme.Über den separaten Hauseingang gelangt man durch ein privates Treppenhaus bis in die Wohnung, welche mit folgenden Highlights überzeugt: • Lichtdurchfluteter Wohnbereich mit Schwedenofen, Galerie und Reduit • Küche mit Kochinsel, Granitabdeckung und modernen Geräten • Drei gemütliche Schlafzimmer mit Parkettboden • Badezimmer mit Eckbadewanne, Dusche und Waschturm • Separates Gäste-WC • Balkon mit Morgensonne • Sitzplatz und eigener Garten mit Nachmittags-/Abendsonne Zur Wohnung gehören eine Garage (Scheune), ein Carport, sowie zwei Aussenabstellplätze. Ein beheizter Hobbyraum sowie zwei Vorrats-/Lagerräume (unbeheizt) gehören ebenfalls zur Wohnung und bieten viel Stauraum. Das Haus wurde vor 1920 erbaut und die Wohnung 1995/1996 gesamtrenoviert. Die Ölheizung wurde 1998 ersetzt und der Boiler 2017.Möchten Sie dieses Bijoux gerne unverbindlich besichtigen oder haben Sie Fragen zu diesem Objekt? Wir freuen uns auf Ihre Kontaktaufnahme: 052 635 10 10;4.5 rooms;140m²;CHF 650,000.–
